{
  "schema_version": "0.1.0",
  "generated_at": "2026-07-15T00:00:00Z",
  "system": {
    "os": "unknown",
    "os_version": "unknown",
    "architecture": "unknown",
    "process_architecture": "unknown",
    "sources": [
      {
        "kind": "fixture",
        "name": "minimal test fixture",
        "collected_at": "2026-07-15T00:00:00Z",
        "confidence": "unknown"
      }
    ]
  },
  "tools": [],
  "findings": []
}
